{
  "visual_language": "cinematic_realism",
  "palette": "muted_warm",
  "texture": "restrained_film_grain",
  "lighting": "motivated_practical",
  "camera_behavior": "observational",
  "motion_density": "low",
  "composition": "balanced",
  "profile_version": "1.0",
  "source": "creator decision"
}
